{
  "$schema": "https://json-schema.org/draft/2020-12/schema",
  "$id": "https://puakiller.example/schemas/rules/benign.schema.json",
  "title": "PUAKILLER Benign Corpus",
  "description": "Machine-readable corpus of legitimate software, process names and publishers that no rule may ever match. Mirrors the corpora inside tests/Test-PuaRules.ps1, which remain authoritative; tests/Test-RuleCatalog.ps1 fails if the two drift apart. This file exists so the intel factory can check a candidate for benign collisions without parsing PowerShell.",
  "type": "object",
  "additionalProperties": false,
  "required": ["schema_version", "source", "names", "processes", "publishers"],
  "properties": {
    "schema_version": { "type": "string", "pattern": "^\\d+\\.\\d+\\.\\d+$" },
    "source": {
      "description": "Path of the authoritative copy.",
      "type": "string",
      "minLength": 1
    },
    "note": { "type": "string", "maxLength": 1024 },
    "names": {
      "description": "Application, folder and file names that must never be flagged, and must never equal a rule's Name. Deliberately includes decoys that collide with real PUA aliases: 'OB', 'Shift', 'PDF Editor', 'Recipe Setup.exe'.",
      "type": "array",
      "minItems": 1,
      "uniqueItems": true,
      "items": { "type": "string", "minLength": 1, "maxLength": 512 }
    },
    "processes": {
      "description": "Legitimate and OS process names that must never appear in any rule's Proc kill list.",
      "type": "array",
      "minItems": 1,
      "uniqueItems": true,
      "items": { "type": "string", "minLength": 1, "maxLength": 256 }
    },
    "publishers": {
      "description": "Legitimate signing publishers that must never match the abused-signer alternation. Includes near misses of real blocked signers, such as 'Work Product Solutions LLC' and 'Shift Technologies Inc.'.",
      "type": "array",
      "minItems": 1,
      "uniqueItems": true,
      "items": { "type": "string", "minLength": 1, "maxLength": 512 }
    }
  }
}
