{
  "schema_version": "1.0.0",
  "source": "tests/Test-PuaRules.ps1",
  "note": "Authoritative copy lives in the test; this file mirrors it for the compiler and the intel factory.",
  "names": [
    "Chrome",
    "Google\\Chrome",
    "Edge",
    "Microsoft\\Edge",
    "Mozilla Firefox",
    "Firefox",
    "Brave",
    "BraveSoftware",
    "Visual Studio Code",
    "Code",
    "Slack",
    "Discord",
    "Zoom",
    "Spotify",
    "Steam",
    "Adobe",
    "Acrobat",
    "Foxit Reader",
    "Foxit PDF Editor",
    "PDF Editor",
    "PDFsam",
    "PDF24",
    "Nitro",
    "Notion",
    "OneDrive",
    "OneNote",
    "Outlook",
    "Microsoft Teams",
    "Teams",
    "Dropbox",
    "Node.js",
    "nodejs",
    "Python",
    "Git",
    "7-Zip",
    "VLC",
    "OBS Studio",
    "OpenOffice",
    "LibreOffice",
    "OpenVPN",
    "OpenSSL",
    "PuTTY",
    "WinRAR",
    "iTunes",
    "Epic Games",
    "NVIDIA",
    "Intel",
    "Docker",
    "Postman",
    "Figma",
    "Notepad++",
    "Sublime Text",
    "JetBrains",
    "Audacity",
    "HandBrake",
    "ShareX",
    "Invoices",
    "Tax2024",
    "Resume",
    "Family Photos",
    "Minecraft",
    "MyConverterNotes",
    "ManualsLib",
    "Recipe Setup.exe",
    "RecipeKeeper",
    "My Recipe Box",
    "Paprika Recipe Manager",
    "MyRecipeSetup.exe",
    "OB",
    "Object Browser",
    "One Browser Tab",
    "OneBrowserNotes",
    "Shift",
    "Night Shift",
    "Shift Work Calendar",
    "Shift4",
    "Shift Notes",
    "C:\\Tools\\Shift\\unrelated.exe"
  ],
  "processes": [
    "chrome",
    "msedge",
    "firefox",
    "brave",
    "node",
    "msiexec",
    "mshta",
    "powershell",
    "pwsh",
    "cmd",
    "svchost",
    "explorer",
    "code",
    "slack",
    "discord",
    "teams",
    "onedrive",
    "notepad",
    "python",
    "git",
    "vlc",
    "setup",
    "installer",
    "update",
    "updater",
    "helper",
    "launcher",
    "viewer",
    "host",
    "service",
    "shift"
  ],
  "publishers": [
    "Microsoft Corporation",
    "Google LLC",
    "Mozilla Corporation",
    "Adobe Inc.",
    "Foxit Software Incorporated",
    "Brave Software, Inc.",
    "Valve",
    "Notion Labs, Inc.",
    "Slack Technologies, Inc.",
    "Apple Inc.",
    "Dropbox, Inc.",
    "NVIDIA Corporation",
    "Intel Corporation",
    "Python Software Foundation",
    "GitHub, Inc.",
    "Igor Pavlov",
    "VideoLAN",
    "Work Product Solutions LLC",
    "Shift Technologies Inc."
  ]
}
